{
  "$schema": "https://json-schema.org/draft/2020-12/schema",
  "$id": "urn:mosaic:protocol:schema:local-preview:v0.2:incompatible-client",
  "title": "Mosaic Local Preview 0.2 Incompatible Client Decision",
  "type": "object",
  "additionalProperties": false,
  "required": [
    "studioSupportedPreviewVersions",
    "clientSupportedPreviewVersions",
    "selectedPreviewVersion",
    "selectedWebSocketSubprotocol",
    "draftSchemaVersion",
    "delivery",
    "diagnostic"
  ],
  "properties": {
    "studioSupportedPreviewVersions": {
      "type": "array",
      "minItems": 1,
      "uniqueItems": true,
      "items": {
        "type": "string",
        "enum": [
          "0.1",
          "0.2"
        ]
      }
    },
    "clientSupportedPreviewVersions": {
      "type": "array",
      "minItems": 1,
      "uniqueItems": true,
      "items": {
        "type": "string",
        "enum": [
          "0.1",
          "0.2"
        ]
      }
    },
    "selectedPreviewVersion": {
      "const": "0.1"
    },
    "selectedWebSocketSubprotocol": {
      "const": "mosaic.local-preview.v0.1"
    },
    "draftSchemaVersion": {
      "const": "0.2"
    },
    "delivery": {
      "const": "withhold"
    },
    "diagnostic": {
      "type": "object",
      "additionalProperties": false,
      "required": [
        "code",
        "message",
        "fallback",
        "recovery"
      ],
      "properties": {
        "code": {
          "const": "preview.incompatibleSchemaVersion"
        },
        "message": {
          "type": "string",
          "minLength": 1,
          "maxLength": 512
        },
        "fallback": {
          "const": "keepLastAcceptedDraft"
        },
        "recovery": {
          "type": "object",
          "additionalProperties": false,
          "required": [
            "action",
            "message"
          ],
          "properties": {
            "action": {
              "const": "updatePreviewClient"
            },
            "message": {
              "type": "string",
              "minLength": 1,
              "maxLength": 512
            }
          }
        }
      }
    }
  }
}
